{"artifact_set_id":"f9e95a698b4c5c97c60148791ce9daafbd906d7fd38f1f89550a530b65524af9","compile_context":{"normalized_digest":"3e7f0dc4dccb60711a2f7016f15ea9b0fe5322125c0a04370215448c8a766dc8","raw_compile_commands_sha256":"e749c9d6270c8587613749aa717faa3dbdd98c2777c186038127969743f2f355"},"counts":{"failed":1,"missing":0,"planned_contexts":5,"planned_records":5,"produced":4,"total_bytes":166928},"generated_at":"2026-09-30T06:30:49.635659Z","kind":"SharedLlvmBitcodeArtifactSet","producer":{"family":"clang","host_triple":"x86_64-unknown-linux-gnu","llvm_version":"21.1.8","version":"21.1.8"},"records":[{"artifact_key":"e8a73074348be6c3ec798bbb3db96d76dd982fd3a3778ef95df871cf2d22d5ce","bitcode":{"bytes":31608,"path":"bitcode/0a947667acb2dc610b435a71261270a9419a165b75ca20ba1ef0018958d4e05d.bc","sha256":"bbb221359d4fea8c01163cfd96dab790aaeb394f94d30efe5e36b1ca295fc767"},"capabilities":["debug.locations","debug.variables","fp.fast-math-flags","fp.operations","llvm.ir-readable","memory.atomic-ordering","memory.fence","memory.syncscope","source.correlation","symbols.linkage","target.data-layout","target.triple"],"compile_record_digest":"624148b944b818a401b101cdd0a45f64025b65e19fdc727fa22a109cca684c95","context_id":"1954cc363a5d86fa49e8f13272201f0309a73244beee9becea6ea1203522f817","debug":"full","diagnostic":null,"input_digests":{"app/main.cpp":"4cd449bfa0400764e8a42f0a256bbf8277a90915e62fab184bb4a529cdf79cd8"},"language":"c++","module_kind":"translation-unit","optimization":"O3","physical_tu_id":"b3cf1ac03970a24104d3616af9ce6711ea43cb4392c5bcc74b797bac256f1d14","producer":{"family":"clang","host_triple":"x86_64-unknown-linux-gnu","llvm_version":"21.1.8","version":"21.1.8"},"production_compiler":{"executable":"c++","family":"gcc","version":"c++ (GCC) 12.3.1 (openEuler 12.3.1-105.oe2403sp3)"},"profile":{"name":"source-preserving","version":"1"},"provenance":{"completeness":"partial","gaps":["header dependency digests are unavailable"]},"record_id":"0a947667acb2dc610b435a71261270a9419a165b75ca20ba1ef0018958d4e05d","semantic_digest":"c687aec07b63ac54873178c43b422722a1f65f0a33a7dd4a171742a4275807f9","sidecars":[],"source":{"path":"app/main.cpp","sha256":"4cd449bfa0400764e8a42f0a256bbf8277a90915e62fab184bb4a529cdf79cd8"},"standard":"c++17","status":"produced","target":{"abi":{"architecture":"x86_64","endianness":"little","pointer_width":null},"data_layout":"e-m:e-p270:32:32-p271:32:32-p272:64:64-i64:64-i128:128-f80:128-n8:16:32:64-S128","triple":"x86_64-unknown-linux-gnu"}},{"artifact_key":"1285a8589abb572ff751af72f974392a3a0e5cc0db9398d84bfa8f10c5632c83","bitcode":{"bytes":25388,"path":"bitcode/35e4a44f1bed304fe5763f2c4e72a43f345499d25d33aa174ef7d02202e3a2a5.bc","sha256":"bc31ac93a22a9a89b75d0d62e2bf0a239dc2293e79ead14e939e87fc0d4e429c"},"capabilities":["debug.locations","debug.variables","fp.fast-math-flags","fp.operations","llvm.ir-readable","memory.atomic-ordering","memory.fence","memory.syncscope","source.correlation","symbols.linkage","target.data-layout","target.triple"],"compile_record_digest":"a8a13b533eae8bb07151d5aaedc96872e8648c6c630819ff8406bfb8a920d706","context_id":"a77bd11628a48afe7e8641278d94eeaffed74caf10c0b99e97d0b401bf8c06db","debug":"full","diagnostic":null,"input_digests":{"src/vectorcalc.cpp":"74b69d0f33d2f2ddd193e330d86888a0b9a30363216f9aa154ca3a65840f5603"},"language":"c++","module_kind":"translation-unit","optimization":"O3","physical_tu_id":"6c2e07d4fd52739ba1258164e56363d9f9103636b2690874d04e7434e97378ba","producer":{"family":"clang","host_triple":"x86_64-unknown-linux-gnu","llvm_version":"21.1.8","version":"21.1.8"},"production_compiler":{"executable":"c++","family":"gcc","version":"c++ (GCC) 12.3.1 (openEuler 12.3.1-105.oe2403sp3)"},"profile":{"name":"source-preserving","version":"1"},"provenance":{"completeness":"partial","gaps":["header dependency digests are unavailable"]},"record_id":"35e4a44f1bed304fe5763f2c4e72a43f345499d25d33aa174ef7d02202e3a2a5","semantic_digest":"ca65a82a231038026acd8f6e237d14cf1135bff6e981cb8366f9ce506eef6b3d","sidecars":[],"source":{"path":"src/vectorcalc.cpp","sha256":"74b69d0f33d2f2ddd193e330d86888a0b9a30363216f9aa154ca3a65840f5603"},"standard":"c++17","status":"produced","target":{"abi":{"architecture":"x86_64","endianness":"little","pointer_width":null},"data_layout":"e-m:e-p270:32:32-p271:32:32-p272:64:64-i64:64-i128:128-f80:128-n8:16:32:64-S128","triple":"x86_64-unknown-linux-gnu"}},{"artifact_key":"a8cf5fd95e0562b9439b0183707ea370d0407a148acf9fb7e8e6cd8852476681","bitcode":null,"capabilities":["debug.locations","debug.variables","fp.fast-math-flags","fp.operations","llvm.ir-readable","memory.atomic-ordering","memory.fence","memory.syncscope","source.correlation","symbols.linkage","target.data-layout","target.triple"],"compile_record_digest":"bf80456c01e230e0f791ac77a3370de1e53cc39cdb1f1ff444cf5c0a49e7ee15","context_id":"7a593ccf1aed6caab60644a66eebb0f0d6a4a561e91e5ece1c50d65181d96594","debug":"full","diagnostic":{"code":"PATH_OUTSIDE_SOURCE_ROOT","detail":"PATH_OUTSIDE_SOURCE_ROOT","detail_en":"PATH_OUTSIDE_SOURCE_ROOT","suggestion":"检查编译上下文后重试","suggestion_en":"Check the compile context and retry"},"input_digests":{"CMakeCXXCompilerABI.cpp":"f6608422cd15ad09afef74dd79ffee884d0efe7ef4e871a93d18cbbcc48dc858"},"language":"c++","module_kind":"translation-unit","optimization":"unknown","physical_tu_id":"ba1a7dd9f6877395716c99bce3c2b55b5e3a9e382102855d97ccd1dc22a347bd","producer":{"family":"clang","host_triple":"x86_64-unknown-linux-gnu","llvm_version":"21.1.8","version":"21.1.8"},"production_compiler":{"executable":"unknown","family":"unknown","version":"unknown"},"profile":{"name":"source-preserving","version":"1"},"provenance":{"completeness":"partial","gaps":["header dependency digests are unavailable"]},"record_id":"4e7cf026bfecbf2f5abd74acb6733217733b8eec6b00316a185cce501e29728c","semantic_digest":"c5555cc36edc28432a09b73420e3c1cb8c878ba89e5f696b601fd8b821f145bb","sidecars":[],"source":{"path":"CMakeCXXCompilerABI.cpp","sha256":"f6608422cd15ad09afef74dd79ffee884d0efe7ef4e871a93d18cbbcc48dc858"},"standard":"c++17","status":"failed","target":{"abi":{},"data_layout":"unknown","triple":"x86_64-unknown-linux-gnu"}},{"artifact_key":"17239988d33c341815b854ecfdc9e5388137e0ff294995e8d039ccd89987e1ec","bitcode":{"bytes":104540,"path":"bitcode/a1adbe1bff7065544ec31a67b8f21cfcdf9bf823fb2bc38754aecd60206ae4d3.bc","sha256":"83d840a31cc9f17a0623744aaac6fbc1196b59026f734ddde951ea5c8e51e66a"},"capabilities":["debug.locations","debug.variables","fp.fast-math-flags","fp.operations","llvm.ir-readable","memory.atomic-ordering","memory.fence","memory.syncscope","source.correlation","symbols.linkage","target.data-layout","target.triple"],"compile_record_digest":"4604c3d01f26362ebe5b004822a47540b91625c85e17ac18d7f5533f3a2b00d1","context_id":"e4aaea4795883f143de096a49cb47ab574b79cf36130a758718ca725277c3b69","debug":"full","diagnostic":null,"input_digests":{"tests/vectorcalc_tests.cpp":"0fd051863a964381f7c5a662bba1be7f190dbbc86e4067e2380582ac652667fd"},"language":"c++","module_kind":"translation-unit","optimization":"O3","physical_tu_id":"a89465d7a486d2a08228dadf7274dc1d1a73a62dc52a22bf286d566621997938","producer":{"family":"clang","host_triple":"x86_64-unknown-linux-gnu","llvm_version":"21.1.8","version":"21.1.8"},"production_compiler":{"executable":"c++","family":"gcc","version":"c++ (GCC) 12.3.1 (openEuler 12.3.1-105.oe2403sp3)"},"profile":{"name":"source-preserving","version":"1"},"provenance":{"completeness":"partial","gaps":["header dependency digests are unavailable"]},"record_id":"a1adbe1bff7065544ec31a67b8f21cfcdf9bf823fb2bc38754aecd60206ae4d3","semantic_digest":"37fad0edec563e388b25e378e4feff8c6e7024c35f8edd3482e09339daa78ebf","sidecars":[],"source":{"path":"tests/vectorcalc_tests.cpp","sha256":"0fd051863a964381f7c5a662bba1be7f190dbbc86e4067e2380582ac652667fd"},"standard":"c++17","status":"produced","target":{"abi":{"architecture":"x86_64","endianness":"little","pointer_width":null},"data_layout":"e-m:e-p270:32:32-p271:32:32-p272:64:64-i64:64-i128:128-f80:128-n8:16:32:64-S128","triple":"x86_64-unknown-linux-gnu"}},{"artifact_key":"688dee22340d215a807e0e39fa9026da17e45eee78bdddfc17a6f65d40545e2a","bitcode":{"bytes":5392,"path":"bitcode/e0015eacd978f5549413eca92f09573ae00883743db2a3b35b45cb25ae914700.bc","sha256":"227639785cb005b5819ae0bf4e8a98074a9cc102318b51df7a76ead78360360b"},"capabilities":["debug.locations","debug.variables","fp.fast-math-flags","fp.operations","llvm.ir-readable","memory.atomic-ordering","memory.fence","memory.syncscope","source.correlation","symbols.linkage","target.data-layout","target.triple"],"compile_record_digest":"468d042e516e55417f164997b45cd6e5dec184e843abd40df53039901426156f","context_id":"2545ae287b6488303ff4c48b4df27f980c5a99f4b7058d0c23ab7bb9b2807eeb","debug":"full","diagnostic":null,"input_digests":{"build/CMakeFiles/3.27.9/CompilerIdCXX/CMakeCXXCompilerId.cpp":"6f94da5ac139bb54c7fa3635112c4e4b3a16ede555b3fbcc0cf275abc9639c98"},"language":"c++","module_kind":"translation-unit","optimization":"unknown","physical_tu_id":"50abbd2fd4e47fb040b6ea484df032e76c393dd047f514fd887e6f532b65aaf7","producer":{"family":"clang","host_triple":"x86_64-unknown-linux-gnu","llvm_version":"21.1.8","version":"21.1.8"},"production_compiler":{"executable":"c++","family":"gcc","version":"c++ (GCC) 12.3.1 (openEuler 12.3.1-105.oe2403sp3)"},"profile":{"name":"source-preserving","version":"1"},"provenance":{"completeness":"partial","gaps":["header dependency digests are unavailable"]},"record_id":"e0015eacd978f5549413eca92f09573ae00883743db2a3b35b45cb25ae914700","semantic_digest":"1ad8727855c6eb1b27bd16de99a306fb9249121b2945f3ada013aaaf36949efa","sidecars":[],"source":{"path":"build/CMakeFiles/3.27.9/CompilerIdCXX/CMakeCXXCompilerId.cpp","sha256":"6f94da5ac139bb54c7fa3635112c4e4b3a16ede555b3fbcc0cf275abc9639c98"},"standard":"c++17","status":"produced","target":{"abi":{"architecture":"x86_64","endianness":"little","pointer_width":null},"data_layout":"e-m:e-p270:32:32-p2